{
  "manifest_version": 1,
  "kind": "cli_run",
  "subject": {
    "type": "cli_run",
    "id": "01K6Q000000000000000000001"
  },
  "song_id": null,
  "created_at": "2026-10-05T10:00:00.000Z",
  "commercial_use": true,
  "provider": {
    "type": "local"
  },
  "models": [
    {
      "role": "dit",
      "id": "ace-step-1.5-turbo",
      "revision": "fixture-pinned-revision",
      "license": "MIT",
      "training_data": "declaracion del proveedor",
      "weights": [],
      "commercial_use": true
    }
  ],
  "pipeline": {
    "engine_id": "acestep",
    "engine_version": "0.1.0",
    "image_digest": null,
    "workflow_id": null,
    "workflow_sha256": null,
    "custom_nodes": [],
    "remote_code": []
  },
  "request": {
    "task": "music.song",
    "params": {
      "duration_s": 3,
      "vocal_language": "es"
    },
    "seed": 42,
    "lyrics_sha256": "82818dbc55465979add95623a8a10de52474e5dbfaca531648cd40b5b0dfe620",
    "lyrics_declaration": "own",
    "style_prompt": "instrumental"
  },
  "inputs": [],
  "lineage": {
    "parents": [],
    "derivation": "original",
    "section_map": null
  },
  "post": {
    "lufs_in": -20,
    "gain_db": 6,
    "limiter": false,
    "true_peak_dbtp": -3,
    "lufs_out": -14
  },
  "outputs": [
    {
      "role": "fixture",
      "path": "fixture.txt",
      "media_type": "text/plain",
      "sha256": "82818dbc55465979add95623a8a10de52474e5dbfaca531648cd40b5b0dfe620",
      "bytes": 21,
      "meta": {}
    }
  ],
  "run": {
    "gpu": null,
    "mode": "fixture",
    "load_s": 0,
    "run_s": 0,
    "vram_peak_mb": 0,
    "vram_cap_mb": 0,
    "spilled": false
  },
  "tools": [
    {
      "name": "ffmpeg",
      "version": "9.0",
      "license": "LGPL-2.1",
      "build": "lgpl",
      "commercial_use": true
    }
  ]
}
